name,description
AccountingProfit,The amount of profit (loss) for a period before deducting tax expense. [Refer: Profit (loss)]
Accruals,"The amount of liabilities to pay for goods or services that have been received or supplied but have not been paid, invoiced or formally agreed with the supplier, including amounts due to employees."
AccrualsAndDeferredIncome,#N/A
AccrualsAndDeferredIncomeClassifiedAsCurrent,#N/A
AccrualsAndDeferredIncomeClassifiedAsNoncurrent,#N/A
AccrualsClassifiedAsCurrent,The amount of accruals classified as current. [Refer: Accruals]
AccrualsClassifiedAsNoncurrent,The amount of accruals classified as non-current. [Refer: Accruals]
AccruedIncome,#N/A
AccruedIncomeIncludingContractAssets,"The amount of assets representing income that has been earned but is not yet a receivable, including contract assets. [Refer: Contract assets]"
AccruedIncomeOtherThanContractAssets,"The amount of assets representing income that has been earned but is not yet a receivable, other than contract assets. [Refer: Contract assets]"
AccumulatedAllowanceForUncollectibleMinimumLeasePaymentsReceivable,#N/A
AccumulatedChangesInFairValueOfFinancialAssetsAttributableToChangesInCreditRiskOfFinancialAssets,"The accumulated increase (decrease) in the fair value of financial assets designated as measured at fair value through profit or loss that is attributable to changes in the credit risk of the assets determined either: (a) as the amount of change in their fair value that is not attributable to changes in market conditions that gave rise to market risk; or (b) using an alternative method that the entity believes more faithfully represents the amount of change in its fair value that is attributable to changes in the credit risk of the asset. [Refer: Credit risk [member]; Market risk [member]; Increase (decrease) in fair value of financial assets designated as measured at fair value through profit or loss, attributable to changes in credit risk of financial assets]"
AccumulatedChangesInFairValueOfFinancialLiabilityAttributableToChangesInCreditRiskOfLiability,"The accumulated increase (decrease) in the fair value of financial liabilities that is attributable to changes in the credit risk of the liabilities. [Refer: Credit risk [member]; Market risk [member]; Increase (decrease) in fair value of financial liability, attributable to changes in credit risk of liability]"
AccumulatedChangesInFairValueOfLoanOrReceivableAttributableToChangesInCreditRiskOfFinancialAssets,The accumulated increase (decrease) in the fair value of loans or receivables that is attributable to changes in the credit risk of the assets determined either: (a) as the amount of change in their fair value that is not attributable to changes in the market conditions that gave rise to the market risk; or (b) using an alternative method the entity believes more faithfully represents the amount of change in its fair value that is attributable to changes in the credit risk of the asset. [Refer: Market risk [member]]
AccumulatedFairValueHedgeAdjustmentOnHedgedItemIncludedInCarryingAmountAssets,"The accumulated amount of fair value hedge adjustment on a hedged item that is included in the carrying amount of the hedged item, recognised in the statement of financial position as an asset. [Refer: Hedged items [member]]"
AccumulatedFairValueHedgeAdjustmentOnHedgedItemIncludedInCarryingAmountLiabilities,"The accumulated amount of fair value hedge adjustment on a hedged item that is included in the carrying amount of the hedged item, recognised in the statement of financial position as a liability. [Refer: Hedged items [member]]"
AccumulatedFairValueHedgeAdjustmentRemainingInStatementOfFinancialPositionForHedgedItemThatCeasedToBeAdjustedForHedgingGainsAndLossesAssets,The accumulated amount of fair value hedge adjustment remaining in the statement of financial position for a hedged item that is a financial asset measured at amortised cost and has ceased to be adjusted for hedging gains and losses. [Refer: Financial assets at amortised cost; Hedged items [member]]
AccumulatedFairValueHedgeAdjustmentRemainingInStatementOfFinancialPositionForHedgedItemThatCeasedToBeAdjustedForHedgingGainsAndLossesLiabilities,The accumulated amount of fair value hedge adjustment remaining in the statement of financial position for a hedged item that is a financial liability measured at amortised cost and has ceased to be adjusted for hedging gains and losses. [Refer: Financial liabilities at amortised cost; Hedged items [member]]
AccumulatedOtherComprehensiveIncome,The amount of accumulated items of income and expense (including reclassification adjustments) that are not recognised in profit or loss as required or permitted by other IFRSs. [Refer: IFRSs [member]; Other comprehensive income]
AcquisitionAndAdministrationExpenseRelatedToInsuranceContracts,The amount of acquisition and administration expense relating to insurance contracts. [Refer: Types of insurance contracts [member]]
AcquisitiondateFairValueOfEquityInterestInAcquireeHeldByAcquirerImmediatelyBeforeAcquisitionDate,The acquisition-date fair value of equity interest in the acquiree held by the acquirer immediately before the acquisition date in a business combination achieved in stages. [Refer: Business combinations [member]]
AcquisitiondateFairValueOfTotalConsiderationTransferred,"The fair value, at acquisition date, of the consideration transferred in a business combination. [Refer: Business combinations [member]]"
AcquisitionrelatedCostsForTransactionRecognisedSeparatelyFromAcquisitionOfAssetsAndAssumptionOfLiabilitiesInBusinessCombination,The amount of acquisition-related costs for transactions recognised separately from the acquisition of assets and the assumption of liabilities in business combinations. [Refer: Business combinations [member]]
AcquisitionrelatedCostsRecognisedAsExpenseForTransactionRecognisedSeparatelyFromAcquisitionOfAssetsAndAssumptionOfLiabilitiesInBusinessCombination,The amount of acquisition-related costs recognised as an expense for transactions that are recognised separately from the acquisition of assets and the assumption of liabilities in business combinations. [Refer: Business combinations [member]]
AcquisitionsThroughBusinessCombinationsBiologicalAssets,The increase in biological assets resulting from acquisitions through business combinations. [Refer: Business combinations [member]; Biological assets]
AcquisitionsThroughBusinessCombinationsDeferredAcquisitionCostsArisingFromInsuranceContracts,The increase in deferred acquisition costs arising from insurance contracts resulting from acquisitions through business combinations. [Refer: Business combinations [member]; Deferred acquisition costs arising from insurance contracts]
AcquisitionsThroughBusinessCombinationsIntangibleAssetsAndGoodwill,The increase in intangible assets and goodwill resulting from acquisitions through business combinations. [Refer: Business combinations [member]; Intangible assets and goodwill]
AcquisitionsThroughBusinessCombinationsIntangibleAssetsOtherThanGoodwill,The increase in intangible assets other than goodwill resulting from acquisitions through business combinations. [Refer: Business combinations [member]; Intangible assets other than goodwill]
AcquisitionsThroughBusinessCombinationsInvestmentProperty,The increase in investment property resulting from acquisitions through business combinations. [Refer: Business combinations [member]; Investment property]
AcquisitionsThroughBusinessCombinationsLiabilitiesUnderInsuranceContractsAndReinsuranceContractsIssued,The increase in liabilities under insurance contracts and reinsurance contracts issued resulting from acquisitions through business combinations. [Refer: Business combinations [member]; Liabilities under insurance contracts and reinsurance contracts issued]
AcquisitionsThroughBusinessCombinationsOtherProvisions,The increase in other provisions resulting from acquisitions through business combinations. [Refer: Business combinations [member]; Other provisions]
AcquisitionsThroughBusinessCombinationsPropertyPlantAndEquipment,"The increase in property, plant and equipment resulting from acquisitions through business combinations. [Refer: Business combinations [member]; Property, plant and equipment]"
AcquisitionsThroughBusinessCombinationsReinsuranceAssets,The increase in reinsurance assets resulting from acquisitions through business combinations. [Refer: Business combinations [member]; Reinsurance assets]
ActuarialAssumptionOfDiscountRates,"The discount rate used as the significant actuarial assumption to determine the present value of a defined benefit obligation. [Refer: Defined benefit obligation, at present value; Actuarial assumptions [member]]"
ActuarialAssumptionOfExpectedRatesOfInflation,"The expected rate of inflation that is used as a significant actuarial assumption to determine the present value of a defined benefit obligation. [Refer: Defined benefit plans [member]; Defined benefit obligation, at present value; Actuarial assumptions [member]]"
ActuarialAssumptionOfExpectedRatesOfPensionIncreases,"The expected rate of increases in pension that is used as a significant actuarial assumption to determine the present value of a defined benefit obligation. [Refer: Defined benefit plans [member]; Defined benefit obligation, at present value; Actuarial assumptions [member]]"
ActuarialAssumptionOfExpectedRatesOfSalaryIncreases,"The expected rate of salary increases used as a significant actuarial assumption to determine the present value of a defined benefit obligation. [Refer: Defined benefit plans [member]; Defined benefit obligation, at present value; Actuarial assumptions [member]]"
ActuarialAssumptionOfLifeExpectancyAfterRetirement,#N/A
ActuarialAssumptionOfMedicalCostTrendRates,"Medical cost trend rate used as significant actuarial assumption to determine the present value of a defined benefit obligation. [Refer: Defined benefit obligation, at present value; Actuarial assumptions [member]]"
ActuarialAssumptionOfMortalityRates,"The mortality rate used as a significant actuarial assumption to determine the present value of a defined benefit obligation. [Refer: Defined benefit obligation, at present value; Actuarial assumptions [member]]"
ActuarialAssumptionOfRetirementAge,#N/A
ActuarialGainsLossesArisingFromChangesInDemographicAssumptionsNetDefinedBenefitLiabilityAsset,"The decrease (increase) in a net defined benefit liability (asset) resulting from actuarial gains (losses) arising from changes in demographic assumptions that result in remeasurements of the net defined benefit liability (asset). Demographic assumptions deal with matters such as: (a) mortality; (b) rates of employee turnover, disability and early retirement; (c) the proportion of plan members with dependants who will be eligible for benefits; (d) the proportion of plan members who will select each form of payment option available under the plan terms; and (e) claim rates under medical plans. [Refer: Net defined benefit liability (asset)]"
ActuarialGainsLossesArisingFromChangesInFinancialAssumptionsNetDefinedBenefitLiabilityAsset,"The decrease (increase) in a net defined benefit liability (asset) resulting from actuarial gains (losses) arising from changes in financial assumptions that result in remeasurements of the net defined benefit liability (asset). Financial assumptions deal with items such as: (a) the discount rate; (b) benefit levels, excluding any cost of the benefits to be met by employees, and future salary; (c) in the case of medical benefits, future medical costs, including claim handling costs (ie the costs that will be incurred in processing and resolving claims, including legal and adjuster's fees); and (d) taxes payable by the plan on contributions relating to service before the reporting date or on benefits resulting from that service. [Refer: Net defined benefit liability (asset)]"
ActuarialGainsLossesArisingFromExperienceAdjustmentsNetDefinedBenefitLiabilityAsset,The decrease (increase) in a net defined benefit liability (asset) resulting from actuarial gains (losses) arising from experience adjustments that result in remeasurements of the net defined benefit liability (asset). Experience adjustments deal with the effects of differences between the previous actuarial assumptions and what has actually occurred. [Refer: Net defined benefit liability (asset)]
ActuarialPresentValueOfPromisedRetirementBenefits,"The present value of the expected payments by a retirement benefit plan to existing and past employees, attributable to the service already rendered."
AdditionalAllowanceRecognisedInProfitOrLossAllowanceAccountForCreditLossesOfFinancialAssets,The amount of additional allowance for credit losses of financial assets recognised in profit or loss. [Refer: Allowance account for credit losses of financial assets]
AdditionalLiabilitiesContingentLiabilitiesRecognisedInBusinessCombination,The amount of additional contingent liabilities recognised in business combinations. [Refer: Contingent liabilities recognised in business combination; Business combinations [member]; Contingent liabilities [member]]
AdditionalPaidinCapital,The amount received or receivable from the issuance of the entity's shares in excess of nominal value and amounts received from other transactions involving the entity's stock or stockholders.
AdditionalProvisionsOtherProvisions,The amount of additional other provisions made. [Refer: Other provisions]
AdditionalRecognitionGoodwill,"The amount of additional goodwill recognised, except goodwill included in a disposal group that, on acquisition, meets the criteria to be classified as held for sale in accordance with IFRS 5. [Refer: Goodwill; Disposal groups classified as held for sale [member]]"
AdditionsFromAcquisitionsInvestmentProperty,The amount of additions to investment property resulting from acquisitions. [Refer: Investment property]
AdditionsFromPurchasesBiologicalAssets,The amount of additions to biological assets resulting from purchases. [Refer: Biological assets]
AdditionsFromSubsequentExpenditureRecognisedAsAssetBiologicalAssets,The amount of additions to biological assets resulting from subsequent expenditure recognised as an asset. [Refer: Biological assets]
AdditionsFromSubsequentExpenditureRecognisedAsAssetInvestmentProperty,The amount of additions to investment property resulting from subsequent expenditure recognised as an asset. [Refer: Investment property]
AdditionsLiabilitiesUnderInsuranceContractsAndReinsuranceContractsIssued,"The increase in liabilities under insurance contracts and reinsurance contracts issued, resulting from additions other than through business combinations. [Refer: Liabilities under insurance contracts and reinsurance contracts issued; Business combinations [member]]"
AdditionsOtherThanThroughBusinessCombinationsBiologicalAssets,"The amount of additions to biological assets, other than those acquired through business combinations. [Refer: Business combinations [member]; Biological assets]"
AdditionsOtherThanThroughBusinessCombinationsIntangibleAssetsOtherThanGoodwill,"The amount of additions to intangible assets other than goodwill, other than those acquired through business combinations. [Refer: Business combinations [member]; Intangible assets other than goodwill]"
AdditionsOtherThanThroughBusinessCombinationsInvestmentProperty,The amount of additions to investment property other than those acquired through business combinations. [Refer: Business combinations [member]; Investment property]
AdditionsOtherThanThroughBusinessCombinationsPropertyPlantAndEquipment,"The amount of additions to property, plant and equipment other than those acquired through business combinations. [Refer: Business combinations [member]; Property, plant and equipment]"
AdditionsOtherThanThroughBusinessCombinationsReinsuranceAssets,"The amount of additions to reinsurance assets, other than those acquired through business combinations. [Refer: Business combinations [member]; Reinsurance assets]"
AdditionsToNoncurrentAssets,"The amount of additions to non-current assets other than financial instruments, deferred tax assets, net defined benefit assets and rights arising under insurance contracts. [Refer: Deferred tax assets; Financial instruments, class [member]; Non-current assets; Types of insurance contracts [member]]"
AdditionsToRightofuseAssets,The amount of additions to right-of-use assets. [Refer: Right-of-use assets]
AdjustedWeightedAverageShares,The weighted average number of ordinary shares outstanding plus the weighted average number of ordinary shares that would be issued on the conversion of all the dilutive potential ordinary shares into ordinary shares. [Refer: Ordinary shares [member]; Weighted average [member]]
AdjustmentToCarryingAmountsReportedUnderPreviousGAAP,"The amount of aggregate adjustments to the carrying amounts reported under previous GAAP of investments in subsidiaries, joint ventures or associates in the entity's first IFRS financial statements. [Refer: Associates [member]; Carrying amount [member]; Joint ventures [member]; Previous GAAP [member]; Subsidiaries [member]; Investments in subsidiaries, joint ventures and associates reported in separate financial statements; IFRSs [member]]"
AdjustmentToMidmarketConsensusPriceSignificantUnobservableInputsAssets,#N/A
AdjustmentToMidmarketConsensusPriceSignificantUnobservableInputsLiabilities,#N/A
AdjustmentToProfitLossForPreferenceShareDividends,Adjustment to profit (loss) for non-participating preference share dividends to calculate profit (loss) attributable to ordinary equity holders of the parent entity. [Refer: Preference shares [member]; Profit (loss)]
AdjustmentsForAmortisationExpense,Adjustments for amortisation expense to reconcile profit (loss) to net cash flow from (used in) operating activities. [Refer: Profit (loss); Depreciation and amortisation expense]
AdjustmentsForAmountsTransferredToInitialCarryingAmountOfHedgedItems,"The amounts removed from equity and included in the initial cost or other carrying amount of a non-financial asset (liability) whose acquisition or incurrence was a hedged, highly probable forecast transaction, net of tax. [Refer: Carrying amount [member]]"
AdjustmentsForCurrentTaxOfPriorPeriod,Adjustments of tax expense (income) recognised in the period for current tax of prior periods.
AdjustmentsForDecreaseIncreaseInBiologicalAssets,Adjustments for decrease (increase) in biological assets to reconcile profit (loss) to net cash flow from (used in) operating activities. [Refer: Biological assets; Profit (loss)]
AdjustmentsForDecreaseIncreaseInDerivativeFinancialAssets,Adjustments for decrease (increase) in derivative financial assets to reconcile profit (loss) to net cash flow from (used in) operating activities. [Refer: Derivative financial assets; Profit (loss)]
AdjustmentsForDecreaseIncreaseInFinancialAssetsHeldForTrading,"Adjustments for decrease (increase) in financial assets held for trading to reconcile profit (loss) to net cash flow from (used in) operating activities. [Refer: Financial assets; Financial assets at fair value through profit or loss, classified as held for trading; Profit (loss)]"
AdjustmentsForDecreaseIncreaseInInventories,Adjustments for decrease (increase) in inventories to reconcile profit (loss) to net cash flow from (used in) operating activities. [Refer: Inventories; Profit (loss)]
AdjustmentsForDecreaseIncreaseInLoansAndAdvancesToBanks,Adjustments for decrease (increase) in loans and advances to banks to reconcile profit (loss) to net cash flow from (used in) operating activities. [Refer: Loans and advances to banks; Profit (loss)]
AdjustmentsForDecreaseIncreaseInLoansAndAdvancesToCustomers,Adjustments for decrease (increase) in loans and advances to customers to reconcile profit (loss) to net cash flow from (used in) operating activities. [Refer: Loans and advances to customers; Profit (loss)]
AdjustmentsForDecreaseIncreaseInOtherAssets,Adjustments for decrease (increase) in other assets to reconcile profit (loss) to net cash flow from (used in) operating activities. [Refer: Other assets; Profit (loss)]
AdjustmentsForDecreaseIncreaseInOtherCurrentAssets,Adjustments for decrease (increase) in other current assets to reconcile profit (loss) to net cash flow from (used in) operating activities. [Refer: Other current assets; Profit (loss)]
AdjustmentsForDecreaseIncreaseInOtherOperatingReceivables,Adjustments for decrease (increase) in other operating receivables to reconcile profit (loss) to net cash flow from (used in) operating activities. [Refer: Profit (loss)]
AdjustmentsForDecreaseIncreaseInPrepaidExpenses,Adjustments for the decrease (increase) in prepaid expenses to reconcile profit (loss) to net cash flow from (used in) operating activities. [Refer: Current prepaid expenses; Profit (loss)]
AdjustmentsForDecreaseIncreaseInReverseRepurchaseAgreementsAndCashCollateralOnSecuritiesBorrowed,Adjustments for decrease (increase) in reverse repurchase agreements and cash collateral on securities borrowed to reconcile profit (loss) to net cash flow from (used in) operating activities. [Refer: Reverse repurchase agreements and cash collateral on securities borrowed; Profit (loss)]
AdjustmentsForDecreaseIncreaseInTradeAccountReceivable,Adjustments for decrease (increase) in trade accounts receivable to reconcile profit (loss) to net cash flow from (used in) operating activities. [Refer: Profit (loss)]
AdjustmentsForDecreaseIncreaseInTradeAndOtherReceivables,Adjustments for decrease (increase) in trade and other receivables to reconcile profit (loss) to net cash flow from (used in) operating activities. [Refer: Trade and other receivables; Profit (loss)]
AdjustmentsForDeferredTaxExpense,Adjustments for deferred tax expense to reconcile profit (loss) to net cash flow from (used in) operating activities. [Refer: Deferred tax expense (income); Profit (loss)]
AdjustmentsForDeferredTaxOfPriorPeriods,Adjustments of tax expense (income) recognised in the period for the deferred tax of prior periods.
AdjustmentsForDepreciationAndAmortisationExpense,Adjustments for depreciation and amortisation expense to reconcile profit (loss) to net cash flow from (used in) operating activities. [Refer: Depreciation and amortisation expense; Profit (loss)]
AdjustmentsForDepreciationAndAmortisationExpenseAndImpairmentLossReversalOfImpairmentLossRecognisedInProfitOrLoss,Adjustments for depreciation and amortisation expense and impairment loss (reversal of impairment loss) to reconcile profit (loss) to net cash flow from (used in) operating activities. [Refer: Impairment loss; Depreciation and amortisation expense; Impairment loss (reversal of impairment loss) recognised in profit or loss; Profit (loss)]
AdjustmentsForDepreciationExpense,Adjustments for depreciation expense to reconcile profit (loss) to net cash flow from (used in) operating activities. [Refer: Profit (loss)]
AdjustmentsForDividendIncome,Adjustments for dividend income to reconcile profit (loss) to net cash flow from (used in) operating activities. [Refer: Dividend income; Profit (loss)]
AdjustmentsForFairValueGainsLosses,Adjustments for fair value losses (gains) to reconcile profit (loss) to net cash flow from (used in) operating activities. [Refer: Profit (loss)]
AdjustmentsForFinanceCosts,Adjustments for finance costs to reconcile profit (loss) to net cash flow from (used in) operating activities. [Refer: Finance costs; Profit (loss)]
AdjustmentsForFinanceIncome,Adjustments for finance income to reconcile profit (loss) to net cash flow from (used in) operating activities. [Refer: Finance income; Profit (loss)]
AdjustmentsForFinanceIncomeCost,Adjustments for net finance income or cost to reconcile profit (loss) to net cash flow from (used in) operating activities. [Refer: Finance income (cost); Profit (loss)]
AdjustmentsForGainLossOnDisposalOfInvestmentsInSubsidiariesJointVenturesAndAssociates,"Adjustments for gain (loss) on disposals investments in subsidiaries, joint ventures and associates to reconcile profit (loss) to net cash flow from (used in) operating activities. [Refer: Associates [member]; Joint ventures [member]; Subsidiaries [member]; Investments in subsidiaries, joint ventures and associates reported in separate financial statements; Profit (loss)]"
AdjustmentsForGainLossOnDisposalsPropertyPlantAndEquipment,"Adjustments for gain (loss) on disposals of property, plant and equipment to reconcile profit (loss) to net cash flow from (used in) operating activities. [Refer: Profit (loss); Property, plant and equipment; Disposals, property, plant and equipment]"
AdjustmentsForGainsLossesOnChangeInFairValueLessCostsToSellBiologicalAssets,Adjustments for gains (losses) on changes in the fair value less costs to sell of biological assets to reconcile profit (loss) to net cash flow from (used in) operating activities. [Refer: Biological assets; Profit (loss)]
AdjustmentsForGainsLossesOnChangeInFairValueOfDerivatives,Adjustments for gains (losses) on changes in the fair value of derivatives to reconcile profit (loss) to net cash flow from (used in) operating activities. [Refer: At fair value [member]; Derivatives [member]; Profit (loss)]
AdjustmentsForGainsLossesOnFairValueAdjustmentInvestmentProperty,"Adjustments for gains (losses) arising from a change in the fair value of investment property to reconcile profit (loss) to net cash flow from (used in) operating activities. [Refer: Investment property; Gains (losses) on fair value adjustment, investment property; Profit (loss)]"
AdjustmentsForImpairmentLossRecognisedInProfitOrLossGoodwill,Adjustments for impairment loss on goodwill recognised in profit or loss to reconcile profit (loss) to net cash flow from (used in) operating activities. [Refer: Goodwill; Impairment loss; Impairment loss recognised in profit or loss]
