name,description
PastServiceCostAndGainsLossesArisingFromSettlementsNetDefinedBenefitLiabilityAsset,s
PastServiceCostNetDefinedBenefitLiabilityAsset,"The increase (decrease) in the net defined benefit liability (asset) resulting from past service cost. Past service cost is the change in the present value of the defined benefit obligation for employee service in prior periods, resulting from a plan amendment (the introduction or withdrawal of, or changes to, a defined benefit plan) or a curtailment (a significant reduction by the entity in the number of employees covered by a plan). [Refer: Net defined benefit liability (asset); Defined benefit plans [member]]"
PayablesForPurchaseOfEnergy,The amount of payables for the purchase of energy.
PayablesForPurchaseOfNoncurrentAssets,The amount of payables for the purchase of non-current assets. [Refer: Non-current assets]
PayablesOnSocialSecurityAndTaxesOtherThanIncomeTax,"The amount of payment due on social security and taxes other than income tax. Income taxes include all domestic and foreign taxes that are based on taxable profits. Income taxes also include taxes, such as withholding taxes, that are payable by a subsidiary, associate or joint arrangement on distributions to the reporting entity."
PaymentsForDebtIssueCosts,The cash outflow for debt issue costs.
PaymentsForDevelopmentProjectExpenditure,The cash outflow for expenditure related to development projects.
PaymentsForExplorationAndEvaluationExpenses,"The cash outflow for expenses incurred by an entity in connection with the exploration for, and evaluation of, mineral resources before the technical feasibility and commercial viability of extracting a mineral resource are demonstrable."
PaymentsForPremiumsAndClaimsAnnuitiesAndOtherPolicyBenefits,"The cash outflow for premiums and claims, annuities and other policy benefits."
PaymentsForShareIssueCosts,The cash outflow for share issue costs.
PaymentsFromChangesInOwnershipInterestsInSubsidiaries,The cash outflow for changes in ownership interests in subsidiaries that do not result in a loss of control. [Refer: Subsidiaries [member]]
PaymentsFromContractsHeldForDealingOrTradingPurpose,The cash outflow for contracts held for dealing or trading purposes.
PaymentsFromPlanNetDefinedBenefitLiabilityAsset,The decrease (increase) in the net defined benefit liability (asset) resulting from payments from the plan. [Refer: Net defined benefit liability (asset)]
PaymentsInRespectOfSettlementsNetDefinedBenefitLiabilityAsset,The decrease (increase) in the net defined benefit liability (asset) resulting from payments from the plan in respect of settlements. [Refer: Decrease (increase) in net defined benefit liability (asset) resulting from gains (losses) arising from settlements; Net defined benefit liability (asset); Defined benefit plans [member]]
PaymentsInRespectOfSettlementsReimbursementRights,"The decrease (increase) in reimbursement rights related to defined benefit obligation, resulting from payments in respect of settlements. [Refer: Decrease (increase) in net defined benefit liability (asset) resulting from gains (losses) arising from settlements; Defined benefit plans [member]]"
PaymentsOfFinanceLeaseLiabilitiesClassifiedAsFinancingActivities,#N/A
PaymentsOfLeaseLiabilitiesClassifiedAsFinancingActivities,"The cash outflow for payment of lease liabilities, classified as financing activities. [Refer: Lease liabilities]"
PaymentsOfOtherEquityInstruments,The cash outflow for payments for equity instruments that the entity does not separately disclose in the same statement or note.
PaymentsToAcquireOrRedeemEntitysShares,The cash outflow to acquire or redeem entity's shares.
PaymentsToAndOnBehalfOfEmployees,"The cash outflow to, and on behalf of, employees."
PaymentsToManufactureOrAcquireAssetsHeldForRentalToOthersAndSubsequentlyHeldForSale,The cash outflow to manufacture or acquire assets held for rental to others and subsequently held for sale.
PaymentsToSuppliersForGoodsAndServices,The cash outflow to suppliers for goods and services.
PaymentsToSuppliersForGoodsAndServicesAndToAndOnBehalfOfEmployees,"The cash outflow for payments to suppliers for goods and services and to, and on behalf of, employees."
PercentageOfEntitysRevenue,The percentage of the entity's revenue. [Refer: Revenue]
PercentageOfReasonablyPossibleDecreaseInActuarialAssumption,The reasonably possible percentage of the decrease in the actuarial assumption used to determine the present value of defined benefit obligation. [Refer: Actuarial assumptions [member]]
PercentageOfReasonablyPossibleDecreaseInUnobservableInputAssets,The percentage of a reasonably possible decrease in an unobservable input used in fair value measurement of assets.
PercentageOfReasonablyPossibleDecreaseInUnobservableInputLiabilities,The percentage of a reasonably possible decrease in an unobservable input used in fair value measurement of liabilities.
PercentageOfReasonablyPossibleIncreaseInActuarialAssumption,The reasonably possible percentage of the increase in the actuarial assumption used to determine the present value of defined benefit obligation. [Refer: Actuarial assumptions [member]]
PercentageOfReasonablyPossibleIncreaseInUnobservableInputAssets,The percentage of a reasonably possible increase in an unobservable input used in fair value measurement of assets.
PercentageOfReasonablyPossibleIncreaseInUnobservableInputLiabilities,The percentage of a reasonably possible increase in an unobservable input used in fair value measurement of liabilities.
PercentageOfVotingEquityInterestsAcquired,The percentage of voting equity interests acquired in a business combination. [Refer: Business combinations [member]]
PlanAssetsAtFairValue,The fair value of defined benefit plan assets. Plan assets comprise assets held by a long-term employee benefit fund and qualifying insurance policies. [Refer: At fair value [member]]
PortfolioAndOtherManagementFeeIncome,The amount of income recognised from portfolio and other management fees.
PortionOfConsiderationPaidReceivedConsistingOfCashAndCashEquivalents,"The portion of consideration paid or received, consisting of cash and cash equivalents, in respect of both obtaining and losing control of subsidiaries or other businesses. [Refer: Subsidiaries [member]; Cash and cash equivalents; Consideration paid (received)]"
PortionOfGainsLossesRecognisedWhenControlOfSubsidiaryIsLostAttributableToDerecognisingRegulatoryDeferralAccountBalancesInFormerSubsidiary,The portion of gains (losses) from losing control of a subsidiary that is attributable to derecognising regulatory deferral account balances in the former subsidiary. [Refer: Gains (losses) recognised when control of subsidiary is lost; Regulatory deferral account balances [member]; Subsidiaries [member]]
PortionOfGainsLossesRecognisedWhenControlOfSubsidiaryIsLostAttributableToRecognisingInvestmentRetainedInFormerSubsidiary,The portion of gains (losses) from losing control of a subsidiary attributable to recognising any investment retained in the former subsidiary at its fair value at the date when control is lost. [Refer: Gains (losses) recognised when control of subsidiary is lost; Subsidiaries [member]]
PostemploymentBenefitExpenseDefinedBenefitPlans,The amount of post-employment benefit expense included in profit or loss relating to defined benefit plans. [Refer: Profit (loss); Defined benefit plans [member]] [Contrast: Increase (decrease) in net defined benefit liability (asset) resulting from expense (income) in profit or loss]
PostemploymentBenefitExpenseDefinedContributionPlans,The amount of post-employment benefit expense relating to defined contribution plans. Defined contribution plans are post-employment benefit plans under which an entity pays fixed contributions into a separate entity (a fund) and will have no legal or constructive obligation to pay further contributions if the fund does not hold sufficient assets to pay all employee benefits relating to employee service in the current and prior periods.
PremiumsWrittenNetOfReinsurance,"The amount of premiums written, net of amounts reinsured with third parties."
Prepayments,Receivables that represent amounts paid for goods and services before they have been delivered.
PrepaymentsAndAccruedIncome,#N/A
PriceIndexMovements,The movements in the general price index used to restate financial statement information of an entity whose functional currency is the currency of a hyperinflationary economy.
PricesSpecifiedInForwardAgreementsToPurchaseFinancialAssetsForCash,Prices specified in forward agreements to purchase financial assets for cash.
ProbabilityOfDefaultSignificantUnobservableInputsAssets,#N/A
ProceedsFromBorrowingsClassifiedAsFinancingActivities,The cash inflow from borrowings obtained. [Refer: Borrowings]
ProceedsFromChangesInOwnershipInterestsInSubsidiaries,The cash inflow from changes in ownership interests in subsidiaries that do not result in a loss of control. [Refer: Subsidiaries [member]]
ProceedsFromContributionsOfNoncontrollingInterests,The cash inflow from proceeds from contributions of non-controlling interests. [Refer: Non-controlling interests]
ProceedsFromCurrentBorrowings,The cash inflow from current borrowings obtained. [Refer: Current borrowings]
ProceedsFromDisposalOfExplorationAndEvaluationAssets,The cash inflow from the disposal of exploration and evaluation assets. [Refer: Exploration and evaluation assets [member]]
ProceedsFromDisposalOfMiningAssets,The cash inflow from the disposal of mining assets. [Refer: Mining assets]
ProceedsFromDisposalOfNoncurrentAssetsOrDisposalGroupsClassifiedAsHeldForSaleAndDiscontinuedOperations,The cash inflow from the disposal of non-current assets or disposal groups classified as held for sale and discontinued operations. [Refer: Discontinued operations [member]; Disposal groups classified as held for sale [member]; Non-current assets or disposal groups classified as held for sale]
ProceedsFromDisposalOfOilAndGasAssets,The cash inflow from disposal of oil and gas assets. [Refer: Oil and gas assets]
ProceedsFromDisposalOrMaturityOfAvailableforsaleFinancialAssets,The cash inflow from the disposal or maturity of available-for-sale financial assets. [Refer: Financial assets available-for-sale]
ProceedsFromDisposalsOfPropertyPlantAndEquipmentIntangibleAssetsOtherThanGoodwillInvestmentPropertyAndOtherNoncurrentAssets,"The cash inflow from the disposal of property, plant and equipment, intangible assets other than goodwill, investment property and other non-current assets. [Refer: Intangible assets other than goodwill; Investment property; Other non-current assets; Property, plant and equipment]"
ProceedsFromExerciseOfOptions,The cash inflow from the exercise of options.
ProceedsFromExerciseOfWarrants,The cash inflow from the exercise of share purchase warrants.
ProceedsFromGovernmentGrantsClassifiedAsFinancingActivities,"The cash inflow from government grants, classified as financing activities. [Refer: Government [member]; Government grants]"
ProceedsFromGovernmentGrantsClassifiedAsInvestingActivities,"The cash inflow from government grants, classified as investing activities. [Refer: Government [member]; Government grants]"
ProceedsFromIssueOfBondsNotesAndDebentures,"The cash inflow from the issuing of bonds, notes and debentures."
ProceedsFromIssueOfOrdinaryShares,The cash inflow from the issuing of ordinary shares. [Refer: Ordinary shares [member]]
ProceedsFromIssueOfPreferenceShares,The cash inflow from the issuing of preference shares. [Refer: Preference shares [member]]
ProceedsFromIssueOfSubordinatedLiabilities,The cash inflow from the issuing of subordinated liabilities. [Refer: Subordinated liabilities]
ProceedsFromIssuingOtherEquityInstruments,The cash inflow from issuing equity instruments that the entity does not separately disclose in the same statement or note.
ProceedsFromIssuingShares,The cash inflow from issuing shares.
ProceedsFromNoncurrentBorrowings,The cash inflow from non-current borrowings obtained. [Refer: Borrowings]
ProceedsFromOtherLongtermAssetsClassifiedAsInvestingActivities,"The cash inflow from sales of long-term assets that the entity does not separately disclose in the same statement or note, classified as investing activities. [Refer: Assets]"
ProceedsFromSaleOrIssueOfTreasuryShares,The cash inflow from the sale or issuing of treasury shares. [Refer: Sale or issue of treasury shares; Treasury shares]
ProceedsFromSalesOfBiologicalAssets,The cash inflow from sales of biological assets. [Refer: Biological assets]
ProceedsFromSalesOfIntangibleAssetsClassifiedAsInvestingActivities,"The cash inflow from sales of intangible assets, classified as investing activities. [Refer: Intangible assets other than goodwill]"
ProceedsFromSalesOfInterestsInAssociates,The cash inflow from sales of interests in associates. [Refer: Associates [member]]
ProceedsFromSalesOfInvestmentProperty,The cash inflow from sales of investment property. [Refer: Investment property]
ProceedsFromSalesOfInvestmentsAccountedForUsingEquityMethod,The cash inflow from sales of investments accounted for using the equity method. [Refer: Investments accounted for using equity method]
ProceedsFromSalesOfInvestmentsOtherThanInvestmentsAccountedForUsingEquityMethod,The cash inflow from sales of investments other than investments accounted for using the equity method. [Refer: Investments accounted for using equity method; Investments other than investments accounted for using equity method]
ProceedsFromSalesOfPropertyPlantAndEquipmentClassifiedAsInvestingActivities,"The cash inflow from sales of property, plant and equipment, classified as investing activities. [Refer: Property, plant and equipment]"
ProceedsFromSalesOrMaturityOfFinancialInstrumentsClassifiedAsInvestingActivities,"The cash inflow from sales or maturity of financial instruments, classified as investing activities. [Refer: Financial instruments, class [member]]"
ProductionSupplies,A classification of current inventory representing the amount of supplies to be used for the production process. [Refer: Inventories]
ProfessionalFeesExpense,The amount of fees paid or payable for professional services.
ProfitLoss,"The total of income less expenses from continuing and discontinued operations, excluding the components of other comprehensive income. [Refer: Other comprehensive income]"
ProfitLossAttributableToNoncontrollingInterests,The profit (loss) from continuing and discontinued operations attributable to non-controlling interests. [Refer: Profit (loss); Non-controlling interests]
ProfitLossAttributableToOrdinaryEquityHoldersOfParentEntity,The profit (loss) attributable to ordinary equity holders of the parent entity. [Refer: Profit (loss)]
ProfitLossAttributableToOrdinaryEquityHoldersOfParentEntityIncludingDilutiveEffects,"The profit (loss) attributable to ordinary equity holders of the parent entity, adjusted for the effects of all dilutive potential ordinary shares. [Refer: Profit (loss)]"
ProfitLossAttributableToOwnersOfParent,The profit (loss) from continuing and discontinued operations attributable to owners of the parent. [Refer: Profit (loss)]
ProfitLossBeforeTax,The profit (loss) before tax expense or income. [Refer: Profit (loss)]
ProfitLossBeforeTaxDiscontinuedOperations,#N/A
ProfitLossFromContinuingOperations,The profit (loss) from continuing operations. [Refer: Continuing operations [member]; Profit (loss)]
ProfitLossFromContinuingOperationsAttributableToNoncontrollingInterests,The profit (loss) from continuing operations attributable to non-controlling interests. [Refer: Profit (loss) from continuing operations; Non-controlling interests]
ProfitLossFromContinuingOperationsAttributableToOrdinaryEquityHoldersOfParentEntity,The profit (loss) from continuing operations attributable to ordinary equity holders of the parent entity. [Refer: Continuing operations [member]; Profit (loss) from continuing operations]
ProfitLossFromContinuingOperationsAttributableToOrdinaryEquityHoldersOfParentEntityIncludingDilutiveEffects,"The profit (loss) from continuing operations attributable to ordinary equity holders of the parent entity, adjusted for the effects of all dilutive potential ordinary shares. [Refer: Profit (loss) from continuing operations]"
ProfitLossFromDiscontinuedOperations,The profit (loss) from discontinued operations. [Refer: Discontinued operations [member]; Profit (loss)]
ProfitLossFromDiscontinuedOperationsAttributableToNoncontrollingInterests,The profit (loss) from discontinued operations attributable to non-controlling interests. [Refer: Profit (loss) from discontinued operations; Non-controlling interests]
ProfitLossFromDiscontinuedOperationsAttributableToOrdinaryEquityHoldersOfParentEntity,The profit (loss) from discontinued operations attributable to ordinary equity holders of the parent entity. [Refer: Profit (loss) from discontinued operations]
ProfitLossFromDiscontinuedOperationsAttributableToOrdinaryEquityHoldersOfParentEntityIncludingDilutiveEffects,"The profit (loss) from discontinued operations attributable to ordinary equity holders of the parent entity, adjusted for the effects of all dilutive potential ordinary shares. [Refer: Profit (loss) from discontinued operations]"
ProfitLossFromOperatingActivities,The profit (loss) from operating activities of the entity. [Refer: Profit (loss)]
ProfitLossOfAcquiree,"The profit (loss) of the acquiree, since the acquisition date, included in the consolidated statement of comprehensive income. [Refer: Profit (loss)]"
ProfitLossOfCombinedEntity,The profit (loss) of the combined entity as though the acquisition date for all business combinations that occurred during the year had been as of the beginning of the annual reporting period. [Refer: Business combinations [member]; Profit (loss)]
ProfitLossRecognisedOnExchangingConstructionServicesForIntangibleAsset2011,The profit (loss) recognised on exchanging construction services for an intangible asset in service concession arrangements. [Refer: Service concession arrangements [member]; Profit (loss)]
ProfitsLossesOnDisposalOfInvestmentsAndChangesInValueOfInvestments,The profit (loss) on disposal of investments and changes in the value of investments. [Refer: Profit (loss)]
ProgressBillings,#N/A
PropertyAmountContributedToFairValueOfPlanAssets,"The amount real estate contributes to the fair value of defined benefit plan assets. [Refer: Plan assets, at fair value; Defined benefit plans [member]]"
PropertyDevelopmentAndProjectManagementExpense,The amount of expense arising from property development and project management.
PropertyDevelopmentAndProjectManagementIncome,The amount of income arising from property development and project management.
PropertyIntendedForSaleInOrdinaryCourseOfBusiness,The amount of property intended for sale in the ordinary course of business of the entity. Property is land or a building - or part of a building - or both.
PropertyManagementExpense,The amount of expense relating to property management. Property is land or a building - or part of a building - or both.
PropertyPlantAndEquipment,"The amount of tangible assets that: (a) are held for use in the production or supply of goods or services, for rental to others, or for administrative purposes; and (b) are expected to be used during more than one period."
PropertyPlantAndEquipmentCarryingAmountAtCostOfRevaluedAssets,"The amount of property, plant and equipment that would have been recognised had the revalued assets been carried under the cost model. [Refer: Property, plant and equipment]"
PropertyPlantAndEquipmentCarryingAmountOfAssetsRetiredFromActiveUse,"The amount of property, plant and equipment retired from active use and not classified as held for sale in accordance with IFRS 5. [Refer: Property, plant and equipment]"
PropertyPlantAndEquipmentCarryingAmountOfRevaluedAssets,"The amount of property, plant and equipment stated at revalued amounts. [Refer: Property, plant and equipment]"
PropertyPlantAndEquipmentExpendituresRecognisedForConstructions,"The amount of expenditures recognised in the carrying amount of an item of property, plant and equipment in the course of its construction. [Refer: Carrying amount [member]; Property, plant and equipment]"
PropertyPlantAndEquipmentFairValueUsedAsDeemedCost,"The amount of property, plant and equipment, for which fair value was used as their deemed cost in the opening IFRS statement of financial position. [Refer: Property, plant and equipment]"
PropertyPlantAndEquipmentGrossCarryingAmountFullyDepreciated,"The gross carrying amount of fully depreciated property, plant and equipment that is still in use. [Refer: Gross carrying amount [member]; Property, plant and equipment]"
PropertyPlantAndEquipmentPledgedAsSecurity,"The amount of property, plant and equipment pledged as security for liabilities. [Refer: Property, plant and equipment]"
PropertyPlantAndEquipmentRecognisedAsOfAcquisitionDate,"The amount recognised as of the acquisition date for plant, property and equipment acquired in a business combination. [Refer: Property, plant and equipment; Business combinations [member]]"
PropertyPlantAndEquipmentRestrictionsOnTitle,"The amount of property, plant and equipment subject to restrictions on title. [Refer: Property, plant and equipment]"
PropertyPlantAndEquipmentRevaluationSurplus,"The amount of revaluation surplus that relates to property, plant and equipment. [Refer: Property, plant and equipment; Revaluation surplus]"
PropertyPlantAndEquipmentTemporarilyIdle,"The amount of temporarily idle property, plant and equipment. [Refer: Property, plant and equipment]"
PropertyServiceChargeExpense,The amount of expense arising from charges related to servicing of property.
PropertyServiceChargeIncome,The amount of income arising from charges related to servicing of property.
PropertyServiceChargeIncomeExpense,The amount of income or expense arising from property service charge. [Refer: Property service charge expense; Property service charge income]
PropertyTaxExpense,The amount of tax expense levied on property. Property is land or a building - or part of a building - or both.
ProportionOfOwnershipInterestInAssociate,The proportion of ownership interest in an associate attributable to the entity. [Refer: Associates [member]]
ProportionOfOwnershipInterestInJointOperation,The proportion of ownership interest in a joint operation attributable to the entity. [Refer: Joint operations [member]]
ProportionOfOwnershipInterestInJointVenture,The proportion of ownership interest in a joint venture attributable to the entity. [Refer: Joint ventures [member]]
ProportionOfOwnershipInterestInSubsidiary,The proportion of ownership interest in a subsidiary attributable to the entity. [Refer: Subsidiaries [member]]
ProportionOfOwnershipInterestsHeldByNoncontrollingInterests,The proportion of ownership interests in a subsidiary held by non-controlling interests. [Refer: Subsidiaries [member]; Non-controlling interests]
ProportionOfVotingPowerHeldInAssociate,The proportion of the voting rights in an associate held by the entity. [Refer: Associates [member]]
ProportionOfVotingPowerHeldInSubsidiary,The proportion of the voting rights in a subsidiary held by the entity. [Refer: Subsidiaries [member]]
ProportionOfVotingRightsHeldByNoncontrollingInterests,The proportion of the voting rights in a subsidiary held by non-controlling interests. [Refer: Subsidiaries [member]; Non-controlling interests]
ProportionOfVotingRightsHeldInJointVenture,The proportion of the voting rights in a joint venture held by the entity. [Refer: Joint ventures [member]]
ProvisionForDecommissioningRestorationAndRehabilitationCosts,"The amount of provision for costs related to decommissioning, restoration and rehabilitation. [Refer: Other provisions]"
ProvisionOfGuaranteesOrCollateralByEntityRelatedPartyTransactions,The amount of guarantees or collateral provided by the entity in related party transactions. [Refer: Guarantees [member]; Related parties [member]]
ProvisionOfGuaranteesOrCollateralToEntityRelatedPartyTransactions,The amount of guarantees or collateral provided to the entity in related party transactions. [Refer: Guarantees [member]; Related parties [member]]
ProvisionUsedOtherProvisions,The amount used (ie incurred and charged against the provision) for other provisions. [Refer: Other provisions]
Provisions,"The amount of liabilities of uncertain timing or amount, including provisions for employee benefits."
ProvisionsForDoubtfulDebtsRelatedToOutstandingBalancesOfRelatedPartyTransaction,The amount of provisions for doubtful debts related to the amount of outstanding balances in related party transactions. [Refer: Provisions]
ProvisionsForEmployeeBenefits,The amount of provisions for employee benefits. [Refer: Employee benefits expense; Provisions]
ProvisionsForFutureNonparticipatingBenefits,The amount of provisions for future non-participating benefits. [Refer: Provisions]
PurchaseOfAvailableforsaleFinancialAssets,The cash outflow for the purchase of available-for-sale financial assets. [Refer: Financial assets available-for-sale]
PurchaseOfBiologicalAssets,The cash outflow for the purchase of biological assets. [Refer: Biological assets]
PurchaseOfExplorationAndEvaluationAssets,The cash outflow for the purchase of exploration and evaluation assets. [Refer: Exploration and evaluation assets [member]]
PurchaseOfFinancialInstrumentsClassifiedAsInvestingActivities,"The cash outflow for the purchase of financial instruments. [Refer: Financial instruments, class [member]]"
PurchaseOfIntangibleAssetsClassifiedAsInvestingActivities,"The cash outflow for the purchases of intangible assets, classified as investing activities. [Refer: Intangible assets other than goodwill]"
PurchaseOfInterestsInAssociates,The cash outflow for the purchase of interests in associates. [Refer: Associates [member]]
