name,description
DecreaseInFairValueMeasurementDueToChangeInOneOrMoreUnobservableInputsToReflectReasonablyPossibleAlternativeAssumptionsAssets,#N/A
DecreaseInFairValueMeasurementDueToChangeInOneOrMoreUnobservableInputsToReflectReasonablyPossibleAlternativeAssumptionsLiabilities,#N/A
DecreaseIncreaseThroughTaxOnSharebasedPaymentTransactions,The decrease (increase) in equity resulting from tax on transactions in which the entity: (a) receives goods or services from the supplier of those goods or services (including an employee) in a share-based payment arrangement; or (b) incurs an obligation to settle the transaction with the supplier in a share-based payment arrangement when another group entity receives those goods or services. [Refer: Share-based payment arrangements [member]]
DecreaseThroughClassifiedAsHeldForSaleBiologicalAssets,The decrease in biological assets through classification as held for sale or inclusion in a disposal group classified as held for sale. [Refer: Disposal groups classified as held for sale [member]; Biological assets]
DecreaseThroughClassifiedAsHeldForSaleGoodwill,The decrease in goodwill due to classification as held for sale. [Refer: Goodwill; Disposal groups classified as held for sale [member]]
DecreaseThroughClassifiedAsHeldForSaleIntangibleAssetsAndGoodwill,The decrease in intangible assets and goodwill resulting from classification as held for sale or inclusion in a disposal group classified as held for sale. [Refer: Disposal groups classified as held for sale [member]; Intangible assets and goodwill]
DecreaseThroughClassifiedAsHeldForSaleIntangibleAssetsOtherThanGoodwill,The decrease in intangible assets other than goodwill resulting from classification as held for sale or inclusion in a disposal group classified as held for sale. [Refer: Disposal groups classified as held for sale [member]; Intangible assets other than goodwill]
DecreaseThroughClassifiedAsHeldForSaleInvestmentProperty,"The decrease in investment property through classification as held for sale or inclusion in a disposal group classified as held for sale. [Refer: Disposal groups classified as held for sale [member]; Property, plant and equipment; Investment property; Disposal groups classified as held for sale [member]]"
DecreaseThroughClassifiedAsHeldForSalePropertyPlantAndEquipment,"The decrease in property, plant and equipment through classification as held for sale or inclusion in a disposal group classified as held for sale. [Refer: Disposal groups classified as held for sale [member]; Property, plant and equipment; Disposal groups classified as held for sale [member]]"
DecreaseThroughDerecognitionExposureToCreditRiskOnLoanCommitmentsAndFinancialGuaranteeContracts,The decrease in exposure to credit risk on loan commitments and financial guarantee contracts resulting from derecognition. [Refer: Exposure to credit risk on loan commitments and financial guarantee contracts]
DecreaseThroughDerecognitionFinancialAssets,The decrease in financial assets resulting from derecognition. [Refer: Financial assets]
DecreaseThroughImpairmentContractAssets,The decrease in contract assets resulting from impairment. [Refer: Contract assets; Impairment loss]
DecreaseThroughImpairmentsRegulatoryDeferralAccountDebitBalances,The decrease in regulatory deferral account debit balances resulting from impairments. [Refer: Impairment loss; Regulatory deferral account debit balances]
DecreaseThroughLossOfControlOfSubsidiaryIntangibleAssetsAndGoodwill,The decrease in intangible assets and goodwill resulting from the loss of control of a subsidiary. [Refer: Intangible assets and goodwill]
DecreaseThroughLossOfControlOfSubsidiaryIntangibleAssetsOtherThanGoodwill,The decrease in intangible assets other than goodwill resulting from the loss of control of a subsidiary. [Refer: Intangible assets other than goodwill]
DecreaseThroughLossOfControlOfSubsidiaryOtherProvisions,The decrease in other provisions resulting from the loss of control of a subsidiary. [Refer: Other provisions]
DecreaseThroughLossOfControlOfSubsidiaryPropertyPlantAndEquipment,"The decrease in property, plant and equipment resulting from the loss of control of a subsidiary. [Refer: Property, plant and equipment]"
DecreaseThroughPerformanceObligationBeingSatisfiedContractLiabilities,The decrease in contract liabilities resulting from the performance obligation being satisfied. [Refer: Contract liabilities; Performance obligations [member]]
DecreaseThroughRightToConsiderationBecomingUnconditionalContractAssets,The decrease in contract assets resulting from the right to consideration becoming unconditional. [Refer: Contract assets]
DecreaseThroughTransferToLiabilitiesIncludedInDisposalGroupsClassifiedAsHeldForSaleOtherProvisions,The decrease in other provisions resulting from the transfer of those provisions to liabilities included in disposal groups classified as held for sale. [Refer: Other provisions; Disposal groups classified as held for sale [member]]
DecreaseThroughWriteoffFinancialAssets,The decrease in financial assets resulting from write-off. [Refer: Financial assets]
DeductibleTemporaryDifferencesForWhichNoDeferredTaxAssetIsRecognised,The amount of deductible temporary differences for which no deferred tax asset is recognised in the statement of financial position. [Refer: Temporary differences [member]]
DeemedCostOfInvestmentsForWhichDeemedCostIsPreviousGAAPCarryingAmount,"The amount of aggregate deemed cost of investments in subsidiaries, joint ventures or associates for which deemed cost is their previous GAAP carrying amount in the entity's first IFRS financial statements. [Refer: Associates [member]; Carrying amount [member]; Joint ventures [member]; Previous GAAP [member]; Subsidiaries [member]; Investments in subsidiaries, joint ventures and associates reported in separate financial statements; IFRSs [member]]"
DeferredAcquisitionCostsArisingFromInsuranceContracts,"The amount of costs that an insurer incurs to sell, underwrite and initiate a new insurance contract whose recognition as an expense has been deferred. [Refer: Types of insurance contracts [member]]"
DeferredIncome,#N/A
DeferredIncomeClassifiedAsCurrent,#N/A
DeferredIncomeClassifiedAsNoncurrent,#N/A
DeferredIncomeIncludingContractLiabilities,"The amount of liabilities representing income that has been received (or the amount is due) but is not yet earned, including contract liabilities. [Refer: Contract liabilities]"
DeferredIncomeIncludingContractLiabilitiesRecognisedAsOfAcquisitionDate,The amount recognised as of the acquisition date for deferred income including contract liabilities assumed in a business combination. [Refer: Deferred income including contract liabilities; Business combinations [member]]
DeferredIncomeRecognisedAsOfAcquisitionDate,#N/A
DeferredTaxAssetWhenUtilisationIsDependentOnFutureTaxableProfitsInExcessOfProfitsFromReversalOfTaxableTemporaryDifferencesAndEntityHasSufferedLossInJurisdictionToWhichDeferredTaxAssetRelates,The amount of deferred tax asset when: (a) the utilisation of the deferred tax asset is dependent on future taxable profits in excess of the profits arising from the reversal of existing taxable temporary differences; and (b) the entity has suffered a loss in either the current or preceding period in the tax jurisdiction to which the deferred tax asset relates. [Refer: Temporary differences [member]]
DeferredTaxAssets,The amounts of income taxes recoverable in future periods in respect of: (a) deductible temporary differences; (b) the carryforward of unused tax losses; and (c) the carryforward of unused tax credits. [Refer: Temporary differences [member]; Unused tax credits [member]; Unused tax losses [member]]
DeferredTaxAssetsRecognisedAsOfAcquisitionDate,The amount recognised as of the acquisition date for deferred tax assets acquired in a business combination. [Refer: Deferred tax assets; Business combinations [member]]
DeferredTaxExpenseArisingFromWritedownOrReversalOfWritedownOfDeferredTaxAsset,"The amount of deferred tax expense arising from the write-down, or reversal of a previous write-down, of a deferred tax asset. [Refer: Deferred tax assets]"
DeferredTaxExpenseIncome,The amount of tax expense (income) relating to changes in deferred tax liabilities and deferred tax assets. [Refer: Deferred tax assets; Deferred tax liabilities]
DeferredTaxExpenseIncomeRecognisedInProfitOrLoss,"The amount of tax expense or income relating to changes in deferred tax liabilities and deferred tax assets, recognised in profit or loss. [Refer: Deferred tax assets; Deferred tax expense (income); Deferred tax liabilities]"
DeferredTaxExpenseIncomeRelatingToOriginationAndReversalOfTemporaryDifferences,The amount of deferred tax expense or income relating to the creation or reversal of temporary differences. [Refer: Temporary differences [member]; Deferred tax expense (income)]
DeferredTaxExpenseIncomeRelatingToTaxRateChangesOrImpositionOfNewTaxes,The amount of deferred tax expense or income relating to tax rate changes or the imposition of new taxes. [Refer: Deferred tax expense (income)]
DeferredTaxLiabilities,The amounts of income taxes payable in future periods in respect of taxable temporary differences. [Refer: Temporary differences [member]]
DeferredTaxLiabilitiesOnLiabilitiesArisingFromContractsWithinScopeOfIFRS4AndNonderivativeInvestmentContracts,The amount of deferred tax liabilities on liabilities arising from the contracts within the scope of IFRS 4 and non-derivative investment contracts. [Refer: Deferred tax liabilities]
DeferredTaxLiabilitiesRecognisedAsOfAcquisitionDate,The amount recognised as of the acquisition date for deferred tax liabilities assumed in a business combination. [Refer: Deferred tax liabilities; Business combinations [member]]
DeferredTaxLiabilityAsset,The amount of deferred tax liabilities or assets. [Refer: Deferred tax liabilities; Deferred tax assets]
DeferredTaxRelatingToItemsChargedOrCreditedDirectlyToEquity,The amount of deferred tax related to items credited (charged) directly to equity. [Refer: Deferred tax expense (income)]
DefinedBenefitObligationAtPresentValue,"The present value, without deducting any plan assets, of expected future payments required to settle the obligation resulting from employee service in the current and prior periods. [Refer: Plan assets, at fair value]"
DepositsFromBanks,The amount of deposit liabilities from banks held by the entity.
DepositsFromCustomers,The amount of deposit liabilities from customers held by the entity.
DepreciationAmortisationAndImpairmentLossReversalOfImpairmentLossRecognisedInProfitOrLoss,"The amount of depreciation expense, amortisation expense and impairment loss (reversal of impairment loss) recognised in profit or loss. [Refer: Depreciation and amortisation expense; Impairment loss (reversal of impairment loss) recognised in profit or loss]"
DepreciationAndAmortisationExpense,The amount of depreciation and amortisation expense. Depreciation and amortisation are the systematic allocations of depreciable amounts of assets over their useful lives.
DepreciationBiologicalAssets,The amount of depreciation recognised on biological assets. [Refer: Depreciation and amortisation expense; Biological assets]
DepreciationExpense,The amount of depreciation expense. Depreciation is the systematic allocation of depreciable amounts of tangible assets over their useful lives.
DepreciationInvestmentProperty,The amount of depreciation recognised on investment property. [Refer: Depreciation and amortisation expense; Investment property]
DepreciationPropertyPlantAndEquipment,"The amount of depreciation of property, plant and equipment. [Refer: Depreciation and amortisation expense; Property, plant and equipment]"
DepreciationRateBiologicalAssetsAtCost,The depreciation rate used for biological assets. [Refer: Biological assets]
DepreciationRatePropertyPlantAndEquipment,"The depreciation rate used for property, plant and equipment. [Refer: Property, plant and equipment]"
DepreciationRightofuseAssets,The amount of depreciation of right-of-use assets. [Refer: Depreciation and amortisation expense; Right-of-use assets]
DerivativeFinancialAssets,The amount of financial assets classified as derivative instruments. [Refer: Financial assets; Derivatives [member]]
DerivativeFinancialAssetsHeldForHedging,The amount of derivative financial assets held for hedging. [Refer: Derivative financial assets]
DerivativeFinancialAssetsHeldForTrading,"The amount of derivative financial assets held for trading. [Refer: Derivative financial assets; Financial assets at fair value through profit or loss, classified as held for trading]"
DerivativeFinancialLiabilities,The amount of financial liabilities classified as derivative instruments. [Refer: Financial assets; Derivatives [member]]
DerivativeFinancialLiabilitiesHeldForHedging,The amount of derivative financial liabilities held for hedging. [Refer: Derivative financial liabilities]
DerivativeFinancialLiabilitiesHeldForTrading,The amount of derivative financial liabilities held for trading. [Refer: Derivative financial liabilities; Financial liabilities at fair value through profit or loss that meet definition of held for trading]
DerivativeFinancialLiabilitiesUndiscountedCashFlows,The amount of contractual undiscounted cash flows in relation to derivative financial liabilities. [Refer: Derivative financial liabilities]
DerivativesAmountContributedToFairValueOfPlanAssets,"The amount derivatives contribute to the fair value of defined benefit plan assets. [Refer: Plan assets, at fair value; Defined benefit plans [member]; Derivatives [member]]"
DescriptionOfAmountsOfEntitysOwnFinancialInstrumentsIncludedInFairValueOfPlanAssets,"The fair value of the entity's own transferable financial instruments that are included in the fair value of defined benefit plan assets. [Refer: Plan assets, at fair value; Financial instruments, class [member]; Defined benefit plans [member]]"
DescriptionOfAmountsOfOtherAssetsUsedByEntityIncludedInFairValueOfPlanAssets,"The fair value of other assets used by the entity that are included in the fair value of defined benefit plan assets. [Refer: Plan assets, at fair value; Defined benefit plans [member]]"
DescriptionOfAmountsOfPropertyOccupiedByEntityIncludedInFairValueOfPlanAssets,"The fair value of property occupied by the entity that are included in the fair value of defined benefit plan assets. [Refer: Plan assets, at fair value; Defined benefit plans [member]]"
DescriptionOfDiscountRatesAppliedToCashFlowProjections,The discount rate applied to cash flow projections for a cash-generating unit (group of units). [Refer: Cash-generating units [member]]
DescriptionOfDiscountRatesUsedInCurrentEstimateOfValueInUse,The discount rate used in the current estimate of the present value of the future cash flows expected to be derived from an asset or cash-generating unit.
DescriptionOfDiscountRatesUsedInPreviousEstimateOfValueInUse,The discount rate used in the previous estimate of the present value of the future cash flows expected to be derived from an asset or cash-generating unit.
DescriptionOfExpectedVolatilityShareOptionsGranted,The expected volatility of the share price used to calculate the fair value of the share options granted. Expected volatility is a measure of the amount by which a price is expected to fluctuate during a period. The measure of volatility used in option pricing models is the annualised standard deviation of the continuously compounded rates of return on the share over a period of time.
DescriptionOfGrowthRateUsedToExtrapolateCashFlowProjections,The growth rate used to extrapolate cash flow projections beyond the period covered by the most recent budgets/forecasts for a cash-generating unit (group of units). [Refer: Cash-generating units [member]]
DescriptionOfOptionLifeShareOptionsGranted,The option life of share options granted.
DescriptionOfRiskFreeInterestRateShareOptionsGranted,"The implied yield currently available on zero-coupon government issues of the country in whose currency the exercise price for share options granted is expressed, with a remaining term equal to the expected term of the option being valued (based on the option's remaining contractual life and taking into account the effects of expected early exercise). [Refer: Government [member]]"
DifferenceBetweenCarryingAmountOfDividendsPayableAndCarryingAmountOfNoncashAssetsDistributed,The amount of difference between the carrying amount of dividends payable and the carrying amount of non-cash assets distributed when settling the dividends payable. [Refer: Carrying amount [member]]
DifferenceBetweenCarryingAmountOfFinancialLiabilityAndAmountContractuallyRequiredToPayAtMaturityToHolderOfObligation,The amount by which the carrying amount of a financial liability is more (less) than the amount that the entity would be contractually required to pay at maturity to the holder of the obligation. [Refer: Carrying amount [member]]
DilutedEarningsLossPerShare,"The amount of profit (loss) attributable to ordinary equity holders of the parent entity (the numerator), divided by the weighted average number of ordinary shares outstanding during the period (the denominator), both adjusted for the effects of all dilutive potential ordinary shares. [Refer: Ordinary shares [member]; Weighted average [member]]"
DilutedEarningsLossPerShareFromContinuingOperations,Diluted earnings (loss) per share from continuing operations. [Refer: Continuing operations [member]; Diluted earnings (loss) per share]
DilutedEarningsLossPerShareFromDiscontinuedOperations,Diluted earnings (loss) per share from discontinued operations. [Refer: Diluted earnings (loss) per share; Discontinued operations [member]]
DilutiveEffectOfConvertibleInstrumentsOnNumberOfOrdinaryShares,The number of dilutive potential ordinary shares that relate to the assumed conversion of the entity's convertible instruments.
DilutiveEffectOfShareOptionsOnNumberOfOrdinaryShares,The number of dilutive potential ordinary shares that relate to the assumed exercise of the entity's share options.
DirectOperatingExpenseFromInvestmentProperty,The amount of direct operating expenses (including repairs and maintenance) arising from investment property. [Refer: Investment property]
DirectOperatingExpenseFromInvestmentPropertyGeneratingRentalIncome,The amount of direct operating expenses (including repairs and maintenance) arising from investment property that generated rental income during the period recognised in profit or loss. [Refer: Investment property]
DirectOperatingExpenseFromInvestmentPropertyNotGeneratingRentalIncome,The amount of direct operating expenses (including repairs and maintenance) arising from investment property that did not generate rental income during the period recognised in profit or loss. [Refer: Investment property]
DirectorsRemunerationExpense,The amount of remuneration paid or payable to the entity's directors.
DiscountRateUsedInCurrentMeasurementOfFairValueLessCostsOfDisposal,The discount rate used in the current measurement of fair value less costs of disposal.
DiscountedUnguaranteedResidualValueOfAssetsSubjectToFinanceLease,"The amount of the discounted unguaranteed residual value of assets subject to finance leases. Unguaranteed residual value is the portion of the residual value of the underlying asset, the realisation of which by a lessor is not assured or is guaranteed solely by a party related to the lessor. Finance lease is a lease that transfers substantially all the risks and rewards incidental to ownership of an underlying asset."
DisposalsAndRetirementsIntangibleAssetsAndGoodwill,The decrease in intangible assets and goodwill resulting from disposals and retirements. [Refer: Intangible assets and goodwill]
DisposalsAndRetirementsIntangibleAssetsOtherThanGoodwill,The decrease in intangible assets other than goodwill resulting from disposals and retirements. [Refer: Intangible assets other than goodwill]
DisposalsAndRetirementsPropertyPlantAndEquipment,"The decrease in property, plant and equipment resulting from disposals and retirements. [Refer: Property, plant and equipment]"
DisposalsBiologicalAssets,The decrease in biological assets resulting from disposals. [Refer: Biological assets]
DisposalsIntangibleAssetsAndGoodwill,The decrease in intangible assets and goodwill resulting from disposals. [Refer: Intangible assets and goodwill]
DisposalsIntangibleAssetsOtherThanGoodwill,The decrease in intangible assets other than goodwill resulting from disposals. [Refer: Intangible assets other than goodwill]
DisposalsInvestmentProperty,The decrease in investment property resulting from disposals. [Refer: Investment property]
DisposalsPropertyPlantAndEquipment,"The decrease in property, plant and equipment resulting from disposals. [Refer: Property, plant and equipment]"
DistributionAndAdministrativeExpense,The amount of expense relating to distribution costs and administrative expenses. [Refer: Administrative expenses; Distribution costs]
DistributionCosts,The amount of costs relating to the distribution of goods and services.
DividendPayables,The amount of dividends that the company has declared but not yet paid.
DividendsClassifiedAsExpense,The amount of dividends classified as an expense.
DividendsPaid,The amount of dividends recognised as distributions to owners.
DividendsPaidClassifiedAsFinancingActivities,"The cash outflow for dividends paid by the entity, classified as financing activities."
DividendsPaidClassifiedAsOperatingActivities,"The cash outflow for dividends paid by the entity, classified as operating activities."
DividendsPaidOrdinaryShares,The amount of dividends paid by the entity on ordinary shares. [Refer: Ordinary shares [member]]
DividendsPaidOrdinarySharesPerShare,The amount of dividends paid per ordinary share.
DividendsPaidOtherShares,The amount of dividends paid by the entity on shares other than ordinary shares. [Refer: Ordinary shares [member]]
DividendsPaidOtherSharesPerShare,The amount of dividends paid per other share.
DividendsPaidToEquityHoldersOfParentClassifiedAsFinancingActivities,"The cash outflow for dividends paid to equity holders of the parent, classified as financing activities."
DividendsPaidToNoncontrollingInterests,The amount of dividends paid to non-controlling interests. [Refer: Non-controlling interests]
DividendsPaidToNoncontrollingInterestsClassifiedAsFinancingActivities,"The cash outflow for dividends paid to non-controlling interests, classified as financing activities. [Refer: Non-controlling interests; Dividends paid to non-controlling interests]"
DividendsPayable,The amount of dividends payable by means of the distribution of non-cash assets to owners.
DividendsProposedOrDeclaredBeforeFinancialStatementsAuthorisedForIssueButNotRecognisedAsDistributionToOwners,The amount of dividends proposed or declared after the reporting period but before financial statements are authorised for issue. Such dividends are not recognised as a liability at the end of the reporting period because no obligation exists at that time.
DividendsProposedOrDeclaredBeforeFinancialStatementsAuthorisedForIssueButNotRecognisedAsDistributionToOwnersPerShare,"The amount, per share, of dividends proposed or declared before financial statements were authorised for issue but not recognised as distribution to owners."
DividendsReceived,The amount of dividends received.
DividendsReceivedClassifiedAsInvestingActivities,"The cash inflow from dividends received, classified as investing activities. [Refer: Dividends received]"
DividendsReceivedClassifiedAsOperatingActivities,"The cash inflow from dividends received, classified as operating activities. [Refer: Dividends received]"
DividendsReceivedFromAssociatesClassifiedAsInvestingActivities,"The cash inflow representing dividends received from associates, classified as investing activities. [Refer: Associates [member]; Dividends received]"
DividendsReceivedFromInvestmentsAccountedForUsingEquityMethodClassifiedAsInvestingActivities,"The cash inflow representing dividends received from investments that are accounted for using the equity method, classified as investing activities. [Refer: Investments accounted for using equity method; Dividends received]"
DividendsReceivedFromJointVenturesClassifiedAsInvestingActivities,"The cash inflow representing dividends received from joint ventures, classified as investing activities. [Refer: Joint ventures [member]; Dividends received]"
DividendsRecognisedAsDistributionsToNoncontrollingInterests,The amount of dividends recognised as distributions to non-controlling interests. [Refer: Non-controlling interests]
DividendsRecognisedAsDistributionsToOwnersOfParent,The amount of dividends recognised as distributions to owners of the parent. [Refer: Parent [member]]
DividendsRecognisedAsDistributionsToOwnersOfParentRelatingToCurrentYear,"The amount of dividends relating to the current year, recognised as distributions to owners of the parent. [Refer: Parent [member]]"
DividendsRecognisedAsDistributionsToOwnersOfParentRelatingToPriorYears,"The amount of dividends relating to prior years, recognised as distributions to owners of the parent. [Refer: Parent [member]]"
DividendsRecognisedAsDistributionsToOwnersPerShare,"The amount, per share, of dividends recognised as distributions to owners."
DividendsRecognisedForInvestmentsInEquityInstrumentsDesignatedAsMeasuredAtFairValueThroughOtherComprehensiveIncomeDerecognisedDuringPeriod,"The amount of dividends related to investments in equity instruments that the entity has designated at fair value through other comprehensive income, derecognised during the reporting period. [Refer: Investments in equity instruments designated at fair value through other comprehensive income [member]]"
